<?xml version="1.0" encoding="UTF-8"?>
<xs:schema xmlns:xs="http://www.w3.org/2001/XMLSchema" targetNamespace="urn:strike-devices:configuration" xmlns:c="urn:strike-devices:configuration" elementFormDefault="qualified">
  <xs:element name="configuration" type="c:Configuration"/>

  <xs:complexType name="Configuration">
    <xs:sequence>
      <xs:group ref="c:Infos"/>
      <xs:element name="image" type="c:DescriptionImage" minOccurs="0"/>
      <xs:sequence>
        <xs:element name="device" type="c:Field"/>
        <xs:element name="version" type="c:Field"/>
        <xs:element name="page" type="c:Page" maxOccurs="unbounded"/>
      </xs:sequence>      
    </xs:sequence>
    <xs:attribute name="def-lang-version" fixed="1" use="required" type="xs:int"/>
    <xs:attribute name="lang" type="xs:language" use="required"/>
    <xs:attribute name="prefix" type="xs:ID" use="required"/>
    <xs:attribute name="icon-path" type="c:RelativePath"/>
  </xs:complexType>
  
  <xs:simpleType name="Field">
    <xs:restriction base="xs:byte">
      <xs:minInclusive value="0"/>
    </xs:restriction>
  </xs:simpleType>
  
  <xs:group name="Infos">
    <xs:sequence>
      <xs:element name="title" maxOccurs="unbounded" type="c:Info"/>
      <xs:element name="help" minOccurs="0" maxOccurs="unbounded" type="c:Info"/>
    </xs:sequence>
  </xs:group>
  
  <xs:complexType name="Info" >
    <xs:simpleContent>
      <xs:extension base="xs:string">
        <xs:attribute name="lang" type="xs:language"/>
      </xs:extension>
    </xs:simpleContent>
  </xs:complexType>
  
  <xs:complexType name="Page">
    <xs:sequence>
      <xs:group ref="c:Infos"/>
      <xs:choice maxOccurs="unbounded">
        <xs:element name="choice" type="c:ChoiceSetting"/>
        <xs:element name="boolean" type="c:BooleanSetting"/>
      </xs:choice>
    </xs:sequence>
  </xs:complexType>

  <xs:complexType name="ChoiceSetting">
    <xs:sequence>
      <xs:group ref="c:Infos"/>
      <xs:element name="image" type="c:DescriptionImage" minOccurs="0"/>
      <xs:element name="option" type="c:Option" maxOccurs="unbounded"/>
    </xs:sequence>
    <xs:attribute name="default" type="xs:IDREF"/>
    <xs:attribute name="prefix" type="c:SettingID"/>
  </xs:complexType>

  <xs:complexType name="BooleanSetting">
    <xs:complexContent>
      <xs:extension base="c:Setting">
        <xs:sequence>
          <xs:element name="image" type="c:DescriptionImage" minOccurs="0"/>
        </xs:sequence>
        <xs:attribute name="default" type="xs:boolean"/>
      </xs:extension>
    </xs:complexContent>
  </xs:complexType>

  <xs:complexType name="Option">
    <xs:complexContent>
      <xs:extension base="c:Setting"/>
    </xs:complexContent>
  </xs:complexType>

  <xs:complexType name="Setting" >
    <xs:group ref="c:Infos"/>
    <xs:attribute name="id" type="c:SettingID"/>
  </xs:complexType>
  
  <xs:simpleType name="SettingID">
    <xs:restriction base="xs:ID">
      <xs:pattern value="(\p{Lu}|_|\d)+"/>
    </xs:restriction>
  </xs:simpleType>
  
  <xs:complexType name="DescriptionImage">
    <xs:group ref="c:Infos"/>
    <xs:attribute name="path" type="c:RelativePath"/>
  </xs:complexType>

  <xs:simpleType name="RelativePath">
    <xs:restriction base="xs:string">
      <xs:pattern value="\w(/|\w|\.|\d| |-|_)*"/>
    </xs:restriction>
  </xs:simpleType>
</xs:schema>